{
  "confirmationDate" : "2025-01-15",
  "tracedWorth" : {
    "value" : 300.45,
    "currency" : "EUR"
  },
  "tradeRelation" : [ "EU-MX, EU-CA" ],
  "catenaXId" : "580d3adf-1981-44a0-a214-13d6ceed9379",
  "contactInformation" : {
    "phoneNumber" : "+49 89 1234567890",
    "person" : "Max Mustermann",
    "email" : "test.mail@example.com",
    "jobTitle" : "executive position"
  },
  "commercialCountryOfOrigin" : "DE",
  "validFrom" : "2025-02-10",
  "type" : "AnnualRequest",
  "federalState" : "BW",
  "preferredStatus" : "Y-Certified",
  "status" : "Not-Completed"
}